[
  {
    "kind": "scout_curator",
    "timestamp": "2026-04-06T10:08:58Z",
    "suggested_terms": [
      {
        "term": "openclaw",
        "frequency": 3,
        "confidence": 0.8
      },
      {
        "term": "jiuwu",
        "frequency": 2,
        "confidence": 0.7
      },
      {
        "term": "resume",
        "frequency": 2,
        "confidence": 0.7
      },
      {
        "term": "wechat",
        "frequency": 2,
        "confidence": 0.7
      }
    ],
    "recommended_sources": []
  },
  {
    "kind": "scout_curator",
    "timestamp": "2026-04-06T14:06:30Z",
    "suggested_terms": [
      {
        "term": "openclaw",
        "frequency": 3,
        "confidence": 0.8
      },
      {
        "term": "jiuwu",
        "frequency": 2,
        "confidence": 0.7
      },
      {
        "term": "resume",
        "frequency": 2,
        "confidence": 0.7
      },
      {
        "term": "wechat",
        "frequency": 2,
        "confidence": 0.7
      }
    ],
    "recommended_sources": []
  },
  {
    "kind": "scout_curator",
    "timestamp": "2026-04-06T14:06:31Z",
    "suggested_terms": [
      {
        "term": "openclaw",
        "frequency": 3,
        "confidence": 0.8
      },
      {
        "term": "jiuwu",
        "frequency": 2,
        "confidence": 0.7
      },
      {
        "term": "resume",
        "frequency": 2,
        "confidence": 0.7
      },
      {
        "term": "wechat",
        "frequency": 2,
        "confidence": 0.7
      }
    ],
    "recommended_sources": []
  },
  {
    "kind": "scout_curator",
    "timestamp": "2026-04-06T14:07:06Z",
    "suggested_terms": [
      {
        "term": "openclaw",
        "frequency": 3,
        "confidence": 0.8
      },
      {
        "term": "jiuwu",
        "frequency": 2,
        "confidence": 0.7
      },
      {
        "term": "resume",
        "frequency": 2,
        "confidence": 0.7
      },
      {
        "term": "wechat",
        "frequency": 2,
        "confidence": 0.7
      }
    ],
    "recommended_sources": []
  },
  {
    "kind": "scout_curator",
    "timestamp": "2026-04-06T14:07:06Z",
    "suggested_terms": [
      {
        "term": "openclaw",
        "frequency": 3,
        "confidence": 0.8
      },
      {
        "term": "jiuwu",
        "frequency": 2,
        "confidence": 0.7
      },
      {
        "term": "resume",
        "frequency": 2,
        "confidence": 0.7
      },
      {
        "term": "wechat",
        "frequency": 2,
        "confidence": 0.7
      }
    ],
    "recommended_sources": []
  }
]